id,content,买方,卖方,标的
1205801293,宁波新日月酒店物业股份有限公司关于拟收购控股子公司部分股权暨关联交易公告。一、交易概况（一）基本情况根据宁波新日月酒店物业股份有限公司（以下简称“公司”或“本公司”）未来发展需要，经交易双方友好协商，公司拟以389万元收购浙江广天日月集团股份有限公司（以下简称“广天日月集团”）持有的本公司控股子公司宁波新日月保安服务有限公司（以下简称“保安公司”）30.00%的股权。保安公司注册资本1100万元，其中本公司和广天日月集团已实缴相应份额的注册资本。本次股权转让完成后，公司持有保安公司的股权比例从51.36%增加至81.36%。,宁波新日月酒店物业股份有限公司,浙江广天日月集团股份有限公司,宁波新日月保安服务有限公司
1205801890,"浙江鹿草堂健康科技股份有限公司出售子公司股权的公告。一、交易情况（一）基本情况转让方：浙江鹿草堂健康科技股份有限公司（以下简称“公司”）受让方：江西天策数码科技有限公司（以下简称“天策数码”）交易标的：公司持有的杭州天赋贸易有限公司（以下简称“天赋贸易”）100%的股权。交易事项：公司将持有的天赋贸易100%的股权，转让给天策数码。交易完成后，公司将不再持有天赋贸易股权。交易价格：4,500,000.00元人民币。",江西天策数码科技有限公司,浙江鹿草堂健康科技股份有限公司,杭州天赋贸易有限公司
1205802825,"上海强生控股股份有限公司关于出售杉德巍康股权的进展公告。公司转让所持杉德巍康企业服务有限公司（以下简称“杉德巍康”）8.2%股权。经上海联合产权交易所公开挂牌交易转让，上海杉瑞投资有限公司（以下简称“杉瑞投资”）以人民币23,999.00万元的价格竞得杉德巍康股权。2019年1月25日，公司与杉瑞投资签署《上海市产权交易合同》。本次交易未构成重大资产重组，交易实施不存在重大法律障碍。本次交易不构成关联交易。本次交易已经公司第九届董事会第十三次会议和2018年第一次临时股东大会审议通过。一、交易概述及进展情况公司第九届董事会第十三次会议和2018年第一次临时股东大会分别审议通过了《关于公司拟转让杉德巍康8.2%股权的议案》，公司拟通过公开挂牌方式转让所持杉德巍康8.2%股权，首次挂牌价格不低于经国资备案后的评估价格23,493.00万元。具体内容详见公司于2018年10月10日披露的《上海强生控股股份有限公司关于拟公开挂牌转让杉德巍康股权的公告》。2018年11月12日至2018年12月7日期间，公司将所持有的杉德巍康8.2%股权在上海联合产权交易所进行公开挂牌，挂牌价格为23,9",上海杉瑞投资有限公司,上海强生控股股份有限公司,杉德巍康企业服务有限公司
1205807104,远东智慧能源股份有限公司关于回复上海证券交易所对公司向控股股东收购股权事项的问询函的公告。远东智慧能源股份有限公司（以下简称“公司”或“智慧能源”）于2019年1月15日收到上海证券交易所《关于对远东智慧能源股份有限公司向控股股东收购股权事项的问询函》，现将函件内容回复如下：2018年7月2日，你公司发布公告称将以7.28亿元向公司控股股东远东控股集团有限公司（以下简称远东控股）收购北京京航安机场工程有限公司（以下简称京航安）49%股权。协议约定，公司在股权转让协议签署后三十个工作日内向控股股东支付股权转让款的50%，控股股东在收到股权转让款的50%后的二十个工作日内办理股权过户。公司已于2018年8月10日向控股股东支付了3.64亿元，但由于京航安49%股权一直处于质押状况，因此上述股权未能过户。2019年1月12日，公司发布进展公告称，上述股权仍未能过户，但目前京航安董事会成员及运营人员无远东控股委派人员，日常管理由上市公司全面控制，公司已实质取得其49%的股权。根据本所《股票上市规则》第17.1条规定，请你公司就以下事项作进一步核实和补充说明。一、请公司向控股股东核实京航安49%,远东智慧能源股份有限公司,远东控股集团有限公司,北京京航安机场工程有限公司
1205808808,"东吴证券股份有限公司关于中电达通数据技术股份有限公司出售子公司股权暨关联交易未履行决策程序的风险揭示公告。东吴证券股份有限公司（以下简称“主办券商”或“东吴证券”）作为中电达通数据技术股份有限公司（证券简称：达通数或“公司”）的主办券商，在对公司持续督导过程中，发现公司将其所持有的北京酷蓝天畅科技有限公司（以下简称“酷蓝天畅”）100%的股权全部转让。该事项未履行相关决策程序，未及时进行信息披露，具体情况如下：主办券商在督导过程中发现,达通数据已将其所持酷蓝天畅47%股权转让给唐雪静、33%股权转让给刘昌年，20%股权转让给江鸿。其中刘昌年为公司监事会主席，本次交易构成关联交易。主办券商通过企查查、天眼查等网站查询得知，该股权转让事宜已于2019年1月9日办理完工商变更。上述股权转让事项公司未履行相关决策程序，未及时履行信息披露义务，且未及时告知主办券商。主办券商认为达通数据向关联人等出售子公司股权的事项，未履行相应的内部决策程序、未及时履行信息披露义务，违反了第1页,共2页《全国中小企业股份转让系统业务规则（试行）》、《中电达通数据技术股份有限公司章程》、《全国中小企业股份转让系统挂",唐雪静、刘昌年、江鸿,中电达通数据技术股份有限公司,北京酷蓝天畅科技有限公司
1205813766,"上海力盛赛车文化股份有限公司关于收购TOPSPEEDLIMITED51%股权完成交割的公告。上海力盛赛车文化股份有限公司（以下简称“公司”）于2018年9月12日召开公司第三届董事会第三次会议审议通过了《关于收购TOPSPEEDLIMITED51%股权的议案》，并于2018年9月21日召开公司第三届董事会第四次（临时）会议审议通过了《关于变更TOPSPEEDLIMITED51%股权实施主体的议案》，同意以自有资金支付港币155,550,000元购买TOPSPEEDLIMITED（以下简称“TopSpeed”）51.00%的股权。具体内容详见公司在指定信息披露媒体及巨潮资讯网上刊登的相关公告。近日公司已与TopSpeed完成了51%股权的交割，并在香港公司注册处完成备案手续。股权交割完成后，公司持有TopSpeed51%股权，TopSpeed成为公司控股子公司并纳入公司合并报表范围内。本次股权交割完成后，TopSpeed的股权结构如下表：序号股东名称持股比例1上海力盛赛车文化股份有限公司51%2DAVIDEDEGOBBI24.5%3FANGYUAN24.5%合计100%特此公告。上海力盛",上海力盛赛车文化股份有限公司,TOPSPEEDLIMITED,TOPSPEEDLIMITED
1205814419,江门甘蔗化工厂（集团）股份有限公司关于参与竞买沈阳含能金属材料制造有限公司25%股权的进展公告。经江门甘蔗化工厂（集团）股份有限公司（以下简称“公司”）第九届董事会第十五次会议及2019年第一次临时股东大会审议通过，公司参与了沈阳含能金属材料制造有限公司25%股权的竞买。详情请参阅公司于2019年1月4日披露的《关于参与竞买沈阳含能金属材料制造有限公司25%股权的公告》及2019年1月23日披露的《2019年第一次临时股东大会决议公告》。2019年1月30日，公司收到上海联合产权交易所有限公司发来的《组织签约通知》，公司成为沈阳含能金属材料制造有限公司25%股权项目的受让方。公司将根据产权转让公告的要求与辽沈工业集团有限公司签订《产权交易合同》。特此公告。江门甘蔗化工厂（集团）股份有限公司董事会二〇一九年一月三十一日1,江门甘蔗化工厂（集团）股份有限公司,辽沈工业集团有限公司,沈阳含能金属材料制造有限公司
1205818092,"关于收购控股子公司股权暨关联交易的公告。新开普电子股份有限公司关于收购控股子公司股权暨关联交易的公告特别提示：1、新开普电子股份有限公司（以下简称“公司”）以3,432万元收购控股子公司福建新开普信息科技有限公司（以下简称“福建新开普”、“标的公司”）39%的股权。2、根据《上市公司重大资产重组管理办法》等有关规定，本次交易事项不构成重大资产重组。根据《深圳证券交易所创业板股票上市规则》（以下简称“《创业板股票上市规则》”）、《新开普电子股份有限公司章程》（以下简称“《公司章程》”）的相关规定，本次交易事项构成关联交易，在董事会审批权限内，无需提交股东大会审议。现将相关事项公告如下：一、交易概述截至本公告日，公司持有福建新开普51%的股权，根据公司整体战略发展规划，为进一步整合资源，完善公司板块布局，提升公司产品创新与销售服务能力，公司于2019年1月31日与福建新开普其他股东吴凤辉、王权汉、王爱娟、陈军方、叶泽泉（以下简称“交易对方”）签订了《股权转让协议》，约定公司拟以自有资金3,432万元收购交易对方持有的福建新开普共计39%的股权（以下简称“本次交易”）。本次交易完成后，公司将",新开普电子股份有限公司,吴凤辉、王权汉、王爱娟、陈军方、叶泽泉,福建新开普信息科技有限公司
1205818836,"山东沃华医药科技股份有限公司关于暂缓收购南昌济顺制药有限公司部分股权暨关联交易的公告。一、关联交易概述2015年5月，公司与青岛中证万融医药科技有限公司（以下简称“青岛中证万融”，系公司实际控制人赵丙贤控制的企业）、何凯南、何凯峰等交易对象达成收购意向，按南昌济顺制药有限公司（以下简称“济顺制药”）净资产评估值作价11,985.00万元收购济顺制药51%股权。同时，青岛中证万融出具了《关于避免同业竞争和规范关联交易的承诺函》，并与公司签订了《股权代管协议》，青岛中证万融同意将其持有济顺制药的剩余29.4%股权委托公司代管，并自承诺函作出日起三年内，按照协商的公允价格将其余29.4%股权转让给公司。截至目前，随着医药市场竞争加剧以及国家医保支付控费等政策的推行，目前医药企业整体上均面临着较大的市场压力，济顺制药2018年亏损969.38万元，公司于2019年1月30日召开第五届董事1会第十四次会议，审议通过了《暂缓收购南昌济顺制药有限公司部分股权暨关联交易的议案》，拟暂缓收购济顺制药29.4%的股权。关联董事赵丙贤回避表决，其他8名非关联董事以8票同意、0票反对、0票弃权审议通过了该事项",山东沃华医药科技股份有限公司,青岛中证万融医药科技有限公司,南昌济顺制药有限公司
1205818836,"山东沃华医药科技股份有限公司关于暂缓收购南昌济顺制药有限公司部分股权暨关联交易的公告。一、关联交易概述2015年5月，公司与青岛中证万融医药科技有限公司（以下简称“青岛中证万融”，系公司实际控制人赵丙贤控制的企业）、何凯南、何凯峰等交易对象达成收购意向，按南昌济顺制药有限公司（以下简称“济顺制药”）净资产评估值作价11,985.00万元收购济顺制药51%股权。同时，青岛中证万融出具了《关于避免同业竞争和规范关联交易的承诺函》，并与公司签订了《股权代管协议》，青岛中证万融同意将其持有济顺制药的剩余29.4%股权委托公司代管，并自承诺函作出日起三年内，按照协商的公允价格将其余29.4%股权转让给公司。截至目前，随着医药市场竞争加剧以及国家医保支付控费等政策的推行，目前医药企业整体上均面临着较大的市场压力，济顺制药2018年亏损969.38万元，公司于2019年1月30日召开第五届董事1会第十四次会议，审议通过了《暂缓收购南昌济顺制药有限公司部分股权暨关联交易的议案》，拟暂缓收购济顺制药29.4%的股权。关联董事赵丙贤回避表决，其他8名非关联董事以8票同意、0票反对、0票弃权审议通过了该事项",山东沃华医药科技股份有限公司,何凯南、何凯峰,南昌济顺制药有限公司
1205819847,"华邦生命健康股份有限公司关于收购重庆市卓瑞纵横生物技术有限公司部分股权暨关联交易的公告。特别提示：1.本次交易不构成重大资产重组；2.本次交易构成关联交易。一、概述华邦生命健康股份有限公司（以下简称“公司”或“华邦健康”）为顺应国家医药行业改革趋势，拓展在新型生物药品领域的布局，强化在创新药研发领域项目、技术和人才的储备，于2019年1月31与关联方张一卓先生签署了《股权转让协议》，以自有资金7,085,272元的价格受让其持有的重庆市卓瑞纵横生物技术有限公司（以下简称“卓瑞纵横公司”）99%的股权。本次股权转让完成后，公司将持有卓瑞纵横公司99%的股权，张一卓先生将不再持有卓瑞纵横公司的股权。根据《深圳证券交易所股票上市规则》、《公司章程》及《关联交易决策制度》等有相关规定，本次交易属于董事会的审批权限内，无需提交股东大会审议。本次交易不构成《上市公司重大资产重组管理办法》规定的重大资产重组，不需要经过有关部门批准。",华邦生命健康股份有限公司,张一卓,重庆市卓瑞纵横生物技术有限公司
1205820852,"南京红太阳股份有限公司南京红太阳股份有限公司关于收购重庆中邦100%股权完成过户工商变更登记的公告。南京红太阳股份有限公司（以下简称“公司”或“红太阳”）于2018年12月10日召开第八届董事会第七次会议和第八届监事会第六次会议、2018年12月27日召开2018第二次临时股东大会审议通过了《关于收购重庆中邦科技有限公司100%股权暨关联交易的的议案》，同意公司以118,607.68万元的交易价格收购江苏红太阳医药集团有限公司（以下简称“红太阳医药集团”）持有的重庆中邦科技有限公司（以下简称“重庆中邦”）100%股权。具体情况详见2018年12月11日、2018年12月28日公司在《中国证券报》、《证券时报》和巨潮资讯网上披露的相关公告。近日公司获悉，重庆中邦在重庆市工商行政管理局万州区分局办理完成了过户工商变更登记手续，并取得了变更后的《营业执照》，相关登记信息如下：公司名称：重庆中邦科技有限公司统一社会信用代码：91500101068256811F住所：重庆市万州经济技术开发区盐气化工园公司类型：有限责任公司法定代表人：王金山注册资本：11,800万元整成立日期：2013年5月20",南京红太阳股份有限公司,江苏红太阳医药集团有限公司,重庆中邦科技有限公司
1205821325,"九州证券股份有限公司关于新疆北新路桥集团股份有限公司收购控股子公司少数股权暨关联交易的核查意见。九州证券股份有限公司（以下简称“九州证券”或“保荐机构”）作为新疆北新路桥集团股份有限公司（以下简称“北新路桥”或“公司”）2016年度非公开发行股票的保荐机构，根据《证券发行上市保荐业务管理办法》、《深圳证券交易所上市公司保荐工作指引》、《深圳证券交易所中小企业板上市公司规范运作指引》等法律、法规、规范性文件的相关规定，对北新路桥收购控股子公司少数股权暨关联交易的情况进行了核查，并发表如下核查意见：一、关联交易的基本情况新疆北新投资建设有限公司（以下简称“北新投资”）系新疆北新路桥集团股份有限公司（以下简称“北新路桥”、“公司”）业务板块的重要子公司。为进一步提升北新路桥整体盈利能力以及业务发展需要，公司根据资金状况拟收购北新投资的部分少数股权。北新路桥第五届董事会第六次会议与2015年第七次临时股东大会分别审议通过了《关于子公司股权融资暨关联交易的议案》，同意全资子公司北新投资与兴业财富资产管理有限公司（以下简称“兴业财富”）签署《增资协议》。根据该协议兴业财富对北新投资增资75,000",兴业财富资产管理有限公司,新疆北新路桥集团股份有限公司,新疆北新投资建设有限公司
1205821481,"厦门科华恒盛股份有限公司关于收购公司控股子公司少数股东部分股权暨关联交易的公告。一、关联交易概述1、厦门科华恒盛股份有限公司（以下简称“公司”或“乙方”）于2019年2月1日召开第七届董事会第二十八次会议，审议通过了《收购公司控股子公司少数股东部分股权暨关联交易的议案》，基于公司总体战略规划，为了更好地支持深圳市康必达控制技术有限公司（以下简称“深圳康必达”或“目标公司”）的发展，公司同意与其少数股东深圳康必达投资合伙企业(有限合伙)（以下简称“交易对方”或“甲方”）签署股权转让协议，以人民币2,396.44万元收购深圳康必达7.8191%股权。本次股权转让完成后，公司将直接持有深圳康必达80%的股权。2、本次交易经公司第七届董事会第二十八次会议审议通过，无需提交股东大会审议。本次交易对方深圳康必达投资合伙企业(有限合伙)为本公司实际控制人、董事长陈成辉先生直接控制的除上市公司及其控股子公司以外的其他法人，本次交易构成本公司的关联交易，关联董事陈成辉先生回避表决。独立董事对本交易发表了事前认可意见及独立意见。3、本次关联交易不构成《上市公司重大资产重组管理办法》规定的重大资产重组，也无",厦门科华恒盛股份有限公司,深圳康必达投资合伙企业,深圳市康必达控制技术有限公司
1205829264,河北华发教育科技股份有限公司关于股权收购完成工商变更登记的公告。本一、基本情况河北华发教育科技股份有限公司（以下简称“华发教育”）于2019年1月7日召开的第二届董事会第七次会议审议通过了《关于收购唐山信发触控电视制造有限公司股权的议案》，公司以321.20万元人民币的价款收购唐山纪通投资咨询有限公司持有的唐山信发触控电视制造有限公司100%的股权，收购完成后，唐山信发触控电视制造有限公司成为公司的全资子公司。具体内容详见2019年1月8日在全国中小企业股份转让系统指定信息披露平台披露的《河北华发教育科技股唐山信发触控电视制造有限公司已经按照规定办理完成工商变更登记手续，并于2019年1月29日取得新换发的《营业执照》。统一社会信用代码：91130293MA07XYDU48名称：唐山信发触控电视制造有限公司类型：有限责任公司住所：唐山高新技术产业园区创业中心D座法定代表人：蒋超注册资本：伍仟万元整成立日期：2016年11月23日经营期限：20,河北华发教育科技股份有限公司,唐山纪通投资咨询有限公司,唐山信发触控电视制造有限公司
1205829739,"山东泰金精锻股份有限公司收购资产的公告。一、交易情况（一）基本情况公司拟以2,287.29万元的价格收购南京铺镇高铁轨道交通车辆锻压有限公司（以下简称“铺镇高铁”）60%的股权，该价格参考铺镇高铁截止2018年6月30日的净资产状况，并结合公司未来的发展前景协商确定。（二）是否构成重大资产重组本次交易不构成重大资产重组。根据《非上市公众公司重大资产重组管理办法》的相关规定：“公众公司及其控股或者控制的公司购买、出售资产，达到下列标准之一的，构成重大资产重组：（一）购买、出售的资产总额占公众公司最近一个会计年度经审计的合并财务会计报表期末资产总额的比例达到50%以上；（二）购买、出售的资产净额占公众公司最近一个会计且购买、出售的资产总额占公众公司最近一个会计年度经审计的合并财务会计报表期末资产总额比例达到30%以上。”根据大华会计师事务所于2018年4月23日出具的大华审字[2018]第006269号无保留意见的《审计报告》，截止2017年12月31日，公司2017年度经审计的合并财务会计财务报表期末资产总额为158,902,922.04元，期末净资产额为65,472,110.45元。本",山东泰金精锻股份有限公司,南京铺镇高铁轨道交通车辆锻压有限公司,南京铺镇高铁轨道交通车辆锻压有限公司
1205834783,绿地控股集团股份有限公司关于收购中民外滩房地产开发有限公司50%股权及相应债权的公告。重要内容提示交易内容公司全资子公司绿地地产集团有限公司收购中国民生投资股份有限公司及其子公司上海佳渡置业有限公司持有的中民外滩房地产开发有限公司50%股权及转让方对标的公司的全部债权，交易价格为121亿元。本次交易未构成关联交易本次交易未构成重大资产重组本次交易实施不存在重大法律障碍一、本次交易概述1、基本情况日前，公司全资子公司绿地地产集团有限公司与中国民生投资股份有限公司及其子公司上海佳渡置业有限公司签署了《股权转让协议》，收购中国民生投资股份有限公司及其子公司上海佳渡置业有限公司持有的中民外滩房地产开发有限公司50%股权及转让方对标的公司的全部债权，双方协商确定的交易价格为121亿元。2、交易生效尚需履行的审批及其他程序本次交易已经公司第九届董事会第三次会议一致审议通过，并于2019年2月13日办理完成了工商变更登记手续。,绿地地产集团有限公司,中国民生投资股份有限公司、上海佳渡置业有限公司,中民外滩房地产开发有限公司
1205839570,四川梓橦宫药业股份有限公司关于收购控股子公司股权的进展公告。本一、基本情况四川梓橦宫药业股份有限公司（以下简称“公司”）于2018年12月25日召开了公司第二届董事会第六次会议，审议通过了《关于收购控股子公司股权的议案》。公司拟以自有资金收购内江市农业产业化中小企业融资担保有限公司持有的公司控股子公司四川梓橦宫投资有限公司40%的股权。具体内容详见公司在全国中小企业股份转让系统指定信息披露平台发布的《四川梓橦宫药业股份有限公司第二届董事会第六次会议决议公告》,四川梓橦宫药业股份有限公司,内江市农业产业化中小企业融资担保有限公司,四川梓橦宫投资有限公司
1205839817,"安徽开润股份有限公司关于收购PT.FormosaBagIndonesia和PT.FormosaDevelopment100%股权完成交割的公告。一、本次交易概述安徽开润股份有限公司（以下简称“公司”、“本公司”）于2018年10月26日与王贻卫、BillionIslandsLtd.、WhiteAngelLtd（.以下合并简称“乙方”、“转让方”）签署了《股权转让协议》。本公司拟通过上市公司名义或上市公司附属机构名义以2,280万美元受让乙方持有的PT．FormosaBagIndonesia、PT．FormosaDevelopment（以下合并简称为“标的公司”）的100％股权。具体内容详见巨潮资讯网www.cninfo.com.cn。本公司于2018年12月25日召开第二届董事会第二十二次会议、第二届监事会第十六次会议，并于2019年1月14日召开2019年第一次临时股东大会，审议通过了《关于收购PT.FormosaBagIndonesia和PT.FormosaDevelopment100%股权的议案》、《关于变更募集资金用途的议案》，同意通过境外全资孙公司Korrun(HK)Limi",安徽开润股份有限公司,BillionIslandsLtd.,PT．FormosaBagIndonesia
