id,content,买方,卖方,标的
1206483912,"上海永利带业股份有限公司关于下属全资子公司收购TopPlastic(HK)CompanyLimited20%股权的公告。一、交易概述1、上海永利带业股份有限公司（以下简称“公司”、“本公司”或“永利股份”）的下属全资子公司YongLiHongKongHoldingLimited（以下简称“永利香港”）拟购买自然人安溟基先生持有的TopPlastic(HK)CompanyLimited有限公司，以下简称“香港塔塑”）20%股权。基于2019年6月30日香港塔塑未经审计的净资产，经双方协商，安溟基先生拟转让香港塔塑20%股权的价格为14,418美元。公司全资子公司青岛英东模塑科技集团有限公司（以下简称“英东模塑”）已持有香港塔塑80%股权，此次股权转让生效后，公司通过英东模塑、永利香港将持有香港塔塑100%股权。香港塔塑主营一般贸易及投资业务。2、2019年7月30日，永利香港与安溟基先生签署了《股权转让协议》。3、本次收购股权的资金来源于自有资金，不涉及关联交易，不构成重大资产重组。根据《深圳证券交易所创业板股票上市规则》、《公司章程》、《总裁工作细则》及《对外投资管理办法》等有关规定，",YongLiHongKongHoldingLimited,安溟基,TopPlastic(HK)CompanyLimited有限公司
1206483939,"北方联合出版传媒（集团）股份有限公司收购控股股东所持版权交易中心股权并进行投资的公告。重要内容提示：交易及投资金额：公司拟以243.47万元收购控股股东出版集团所持版权交易中心71.43%的全部股权，并承担其尚未缴纳注册资本的实际出资责任4,700万元。本次交易构成关联交易，不构成《上市公司重大资产重组管理办法》规定的重大资产重组。本次交易需公司董事会审议批准，无需公司股东大会审批。一、本次交易及投资概述为推动版权产业发展，集聚优势版权资源，助力主业加快发展，北方联合出版传媒（集团）股份有限公司（以下简称“出版传媒”或“公司”）拟以自有资金243.47万元收购控股股东辽宁出版集团有限公司（以下简称“出版集团”）所持北方国家版权交易中心有限公司(以下简称“版权交易中心”)71.43%的全部股权，并承担其尚未缴纳注册资本的实际出资责任4,700万元。由于出版集团为公司的控股股东，本次交易构成关联交易。截至本公告日，过去12个月内公司与出版集团及其他关联人之间未发生本次交易类别相关的交易。1根据《上市公司重大资产重组管理办法》，该事项不构成重大资产重组。",北方联合出版传媒（集团）股份有限公司,辽宁出版集团有限公司,北方国家版权交易中心有限公司
1206484505,"迪安诊断技术集团股份有限公司关于出售浙江博圣生物技术股份有限公司部分股权的公告。一、交易概述1、最近十二个月内交易概述2019年3月13日迪安诊断技术集团股份有限公司（以下简称“公司”或“迪安诊断”）召开第三届董事会第三十三次会议，审议通过了《关于出售浙江博圣生物技术股份有限公司部分股权的议案》，公司向湖南光控星宸股权投资合伙企业（有限合伙）转让所持有的浙江博圣生物技术股份有限公司（以下简称“博圣生物”）0.96%的股权，转让价格为人民币3,000万元。本次转让完成后，公司及其子公司合计持有博圣生物23.2816%股权。该笔交易预计为公司带来820万元处置收益。2019年5月13日公司召开第三届董事会第三十八次会议，审议通过了《关于出售浙江博圣生物技术股份有限公司部分股权的议案》，公司向杭州熠杰投资合伙企业（有限合伙）转让所持有的博圣生物0.512%的股权，转让价格为人民币1,600万元。本次转让完成后，公司及其子公司合计持有博圣生物22.7696%股权。该笔交易预计为公司带来430万元处置收益。上述两笔交易均未达到《深圳证券交易所创业板股票上市规则》规定的披露标准，未构成关联交易，不",湖南光控星宸股权投资合伙企业,迪安诊断技术集团股份有限公司,浙江博圣生物技术股份有限公司
1206484744,"万华化学集团股份有限公司关于下属公司收购ChematurTechnologiesAB100%股权的公告。重要内容提示：万华化学集团股份有限公司（以下简称“万华化学”）境外全资下属公司万华化学（匈牙利）控股有限公司收购吉林市康乃尔投资集团有限公司（以下简称“康乃尔”）和欧美能源技术有限公司持有的ChematurTechnologiesAB（以下简称“瑞典国际化工”）100%股权。本次收购为有条件收购，在交易对手方履行完本公告四、3项下的义务后，总收购金额约等值人民币925,445,229元。本次交易不构成关联交易，不构成重大资产重组，不存在重大法律障碍。本次股权收购无需经公司董事会及股东大会审议，无需经政府有关部门的批准。特别风险提示：瑞典国际化工拥有MDI、TDI、过氧化氢、生物化工等技术。本次股权收购完成后，其经营范围可能发生变化，存在营业收入波动的风险。注：汇率折算：总金额以1美元=6.8747人民币汇率计算一、交易概述（一）收购股权的基本情况万华化学集团股份有限公司近期接到境外全资下属公司万华化学（匈牙利）控股有限公司通知，其已经完成了收购吉林市康乃尔投资集团有限公司（以下",万华化学（匈牙利）控股有限公司,吉林市康乃尔投资集团有限公司、欧美能源技术有限公司,ChematurTechnologiesAB
1206487879,凌志环保股份有限公司关于全资子公司收购参股公司股权的公告。一、交易情况（一）基本情况因公司战略布局调整，凌志环保股份有限公司（以下简称“公司”）全资子公司江苏凌志环保工程有限公司（以下简称“工程公司”）拟收购江西洪城水业环保有限公司（以下简称“洪城水业”）所持江西凌志水处理设备有限公司（以下简称“江西凌志”）51%股权，最终收购价格以江西凌志审计评估价为准，收购完成后洪城水业将不再持有江西凌志股权。,江苏凌志环保工程有限公司,江西洪城水业环保有限公司,江西凌志水处理设备有限公司
1206488155,"浙江鹿草堂健康科技股份有限公司收购股权资产的公告。一、交易情况（一）基本情况浙江鹿草堂健康科技股份有限公司（以下简称“公司”）于2019年7月29日与上海鹿宜升健康科技股份有限公司（以下简称“鹿宜升”）签订《拟收购框架协议》，拟将鹿宜升持有的内蒙古鹿神酒业有限公司（以下简称“鹿神酒业”）100%的股权以截至2019年1月31日经审计净资产值6,922,214.78元作价转让给公司。",浙江鹿草堂健康科技股份有限公司,上海鹿宜升健康科技股份有限公司,内蒙古鹿神酒业有限公司
1206489484,上海白虹软件科技股份有限公司出售控股子公司股权暨关联交易的公告。一、交易概况（一）基本情况出让方：上海白虹软件科技股份有限公司（以下简称“公司”）受让方：付华南交易标的：公司持有的控股子公司上海虹卫信息科技有限公司（以下简称“上海虹卫”）60%股权交易事项：上海白虹软件科技股份有限公司拟将持有的控股子公司上海虹卫的60%的股权全部转让给自然人付华南交易价格：人民币1万元,付华南,上海白虹软件科技股份有限公司,上海虹卫信息科技有限公司
1206493818,"万马科技股份有限公司关于变更部分募集资金用途暨收购安华智能股权的公告。特别提示：1、原募集资金投资项目名称为“通信及信息化设备生产建设项目”。2、变更部分募集资金投资项目名称：（1）收购安华智能股份公司（以下简称“安华智能”）51%股权项目：股权转让对价5,087.25万元，非分期情况下在约定的先决条件全部得到满足或经公司书面豁免后的10个工作日内一次性支付。（2）3,000万元补充公司流动资金。3、变更募集资金投资项目用途：用于支付安华智能51%股权转让价款，部分补充公司流动资金。4、业绩承诺：安华智能在2019年、2020年和2021年实现的净利润数额分别不低于1,200万元、1,300万元、1,500万元，或该三年累计净利润不低于4,000万元，以上两种标准满足其一即可。5、本次变更部分募集资金投向用于上述收购的行为不构成关联交易，也不构成《上市公司重大资产重组管理办法》规定的重大资产重组，本事项尚需提交公司股东大会审议批准。一、变更募集资金投资项目的概述（一）首次公开发行股票募集资金情况万马科技股份有限公司（以下简称“公司”）经中国证券监督管理委员会《关于核准万马科技股份有限公",万马科技股份有限公司,安华智能股份公司,安华智能股份公司
1206495558,"北京天时恒生网络股份有限公司出售孙公司股权的公告。一、交易概况（一）基本情况交易标的名称：天时汇电子所持有的深圳天时国际贸易有限公司（以下简称“深圳天时”）100%的股权转让方：天时汇（北京）电子商务有限公司（以下简称“天时汇电子”）受让方：保兆伟交易事项：天时汇电子将其持有的深圳天时100%股权全部转让给保兆伟。交易价格：保兆伟以人民币113,857.61元的转让价格，受让天时汇电子持有的深圳天时100%的股权。",保兆伟,天时汇（北京）电子商务有限公司,深圳天时国际贸易有限公司
1206495860,关于竞买山西西山晋兴能源有限责任公司部分股权进展的公告。根据公司于2019年6月13日召开的第七届董事会第十一次会议及2019年7月1日召开的2019年第二次临时股东大会审议通过的《关于竞买山西西山晋兴能源有限责任公司部分股权的议案》决议，公司通过上海联合产权交易所参与了本次竞买。现将本次竞买事项的进展情况公告如下：公司以挂牌价12.8亿元取得山西西山晋兴能源有限责任公司10%股权的竞买权，并于2019年8月2日与转让方华能国际电力股份有限公司就山西西山晋兴能源有限责任公司10%股权的转让事宜签订了《产权交易合同》。根据上海联合产权交易所安排，在转让价款支付完毕后，交易双方将共同配合，于合同生效后30个工作日内完成产权持有主体的权利交接，并在获得上海联合产权交易所出具的产权交易凭证后30个工作日内，配合山西西山晋兴能源有限责任公司办理产权交易标的的权证变更登记手续。特此公告。山西西山煤电股份有限公司董事会2019年8月2日,山西西山煤电股份有限公司,华能国际电力股份有限公司,山西西山晋兴能源有限责任公司
1206496416,"广东众生药业股份有限公司关于收购广东逸舒制药股份有限公司小股东部分股权的公告。一、对外投资概述广东众生药业股份有限公司（以下简称“公司”）于2017年10月24日召开第六届董事会第九次会议，全体董事一致审议通过《关于收购广东逸舒制药股份有限公司部分股权的议案》，同意公司使用自有资金不超过人民币422,761,613.17元向黄庆文、黄庆雄、黄苏苹、欧俊华、刘凌梅收购其合计所持有的广东逸舒制药股份有限公司（以下简称“逸舒制药”、“标的公司”）80.5260%股权。具体内容详见公司于2017年10月25日刊登在《证券时报》和巨潮资讯网的相关公告。公司于2018年8月31日召开第六届董事会第十八次会议，全体董事一致审议通过《关于收购广东逸舒制药股份有限公司小股东部分股权的议案》，同意公司使用自有资金人民币76,648,672.10元向黄苏苹、欧俊华、刘凌梅、黄庆文收购其合计所持有的逸舒制药12.2221%股权。具体内容详见公司于2018年9月1日刊登在《证券时报》和巨潮资讯网的相关公告。公司于2019年4月21日召开第六届董事会第二十六次会议，全体董事一致审议通过《关于收购广东逸舒制药股份有",广东众生药业股份有限公司,黄庆文、黄庆雄、黄苏苹、欧俊华、刘凌梅,广东逸舒制药股份有限公司
1206498696,"广东达志环保科技股份有限公司关于使用自有资金收购广州市海科顺表面处理有限公司48%股权的公告。本一、交易概述1、交易基本情况2019年8月2日，广东达志环保科技股份有限公司（以下简称“公司”）与蒲海丽、广州市海科顺表面处理有限公司（以下简称“海科顺”、“标的公司”或“目标公司”）签署了《广州市海科顺表面处理有限公司股权转让协议》，公司拟以自有资金1,555.20万元人民币收购蒲海丽持有的海科顺48%的股权。本次股权转让完成后公司将持有海科顺100%的股权。根据《深圳证券交易所创业板股票上市规则》、《公司章程》等相关规定，公司本次收购不构成关联交易，亦不构成《上市公司重大资产重组管理办法》规定的重大资产重组。2、审批程序2019年8月2日，公司第三届董事会第二十二次会议审议通过了《关于公司收购广州市海科顺表面处理有限公司48%股权的议案》，公司两名独立董事发表了同意的独立意见。根据《创业板股票上市规则》相关规定及公司相关制度，本次收购属于董事会审批权限范围，无需提交公司股东大会审议批准。",广东达志环保科技股份有限公司,蒲海丽,广州市海科顺表面处理有限公司
1206499843,"广州阿拉丁物联网络科技股份有限公司终止收购股权资产的公告。2019年4月，广州阿拉丁物联网络科技股份有限公司（以下简称“公司”）与北京千末文化科技有限公司（以下简称“千末文化”）股东郑毅先生签订《股权转让协议》。公司受让郑毅先生持有的千末文化5%的股权。同时，公司拟以人民币1,500,000.00元的价格对千末文化进行实缴出资。本次收购完成后，公司将持有千末文化5%的股权。由于外部客观环境变化及千末文化内部经营问题，经双方友好协商，一致同意解除《股权转让协议》。公司终止收购千末文化股权资产。广州阿拉丁物联网络科技股份有限公司董事会2019年8月5日",广州阿拉丁物联网络科技股份有限公司,郑毅,北京千末文化科技有限公司
1206502209,"江苏中超控股股份有限公司关于出售控股子公司股权暨关联交易的公告。一、关联交易情况概述1、基本情况为调整产业结构以减轻负担、轻装前行，江苏中超控股股份有限公司（以下简称“公司”）拟将持有的无锡锡洲电磁线有限公司（以下简称“锡洲电磁线”）51%的股权以人民币7,500万元的价格转让给郁伟民、郁晓春。其中，郁伟民受让公司所持有的锡洲电磁线26%股权，股权转让款为人民币3,823.53万元；郁晓春受让公司所持有的锡洲电磁线25%股权，股权转让款为人民币3,676.47万元。转让完成后，公司将不再持有锡洲电磁线股权。郁伟民为公司监事，按照《深圳证券交易所股票上市规则》规定，郁伟民为公司的关联自然人，本事项属于关联交易。2、董事会审议情况2019年8月5日，公司召开第四届董事会第二十次会议以7票同意、0票反对、0票弃权审议通过了《关于出售控股子公司股权暨关联交易的议案》。公司独立董事也就该关联交易进行了事前审核，并发表了独立意见。根据《公司章程》、《中小企业板上市公司规范运作指引》和《关联交易管理办法》等的规定，本次关联交易事项属于公司股东大会审批权限，需提交股东大会审议。3、本次关联交易不构成《",郁伟民、郁晓春,江苏中超控股股份有限公司,无锡锡洲电磁线有限公司
1206502267,"云铝股份云南铝业股份有限公司关于收购公司控股子公司鹤庆溢鑫铝业有限公司部分股权的公告。一、交易概述（一）本次交易基本情况云南铝业股份有限公司（以下简称“云铝股份”或“公司”）为进一步做优做强绿色低碳水电铝材一体化产业链，不断提升公司水电铝权益产业规模，公司将收购鹤庆县工业投资有限公司（以下简称“鹤庆工投”）持有的公司控股子公司鹤庆溢鑫铝业有限公司（以下简称“鹤庆溢鑫”）23.65%股权，同时根据公司业务整合需要，公司将受让公司全资子公司云南文山铝业有限公司（以下简称“文山铝业”）持有鹤庆溢鑫3.56%股权，鹤庆溢鑫其他股东放弃本次收购的优先购买权。云铝股份本次收购鹤庆工投持有鹤庆溢鑫23.65%股权的交易事项已聘请具有证券、期货相关业务评估资格的中联资产评估集团有限公司（以下简称“中联评估”）出具了资产评估报告，并经鹤庆县国有资产监督管理委员会备案。根据评估备案结果，鹤庆溢鑫截止2019年4月30日净资产评估价值为83,200.00万元，按照鹤庆工投对鹤庆溢鑫的实缴出资比例为13.71%计算，经与鹤庆工投协商一致，确定最终交易对价为11,400.00万元，评估基准日至股权交割日的期间损",云南铝业股份有限公司,鹤庆县工业投资有限公司,鹤庆溢鑫铝业有限公司
1206502267,"云铝股份云南铝业股份有限公司关于收购公司控股子公司鹤庆溢鑫铝业有限公司部分股权的公告。一、交易概述（一）本次交易基本情况云南铝业股份有限公司（以下简称“云铝股份”或“公司”）为进一步做优做强绿色低碳水电铝材一体化产业链，不断提升公司水电铝权益产业规模，公司将收购鹤庆县工业投资有限公司（以下简称“鹤庆工投”）持有的公司控股子公司鹤庆溢鑫铝业有限公司（以下简称“鹤庆溢鑫”）23.65%股权，同时根据公司业务整合需要，公司将受让公司全资子公司云南文山铝业有限公司（以下简称“文山铝业”）持有鹤庆溢鑫3.56%股权，鹤庆溢鑫其他股东放弃本次收购的优先购买权。云铝股份本次收购鹤庆工投持有鹤庆溢鑫23.65%股权的交易事项已聘请具有证券、期货相关业务评估资格的中联资产评估集团有限公司（以下简称“中联评估”）出具了资产评估报告，并经鹤庆县国有资产监督管理委员会备案。根据评估备案结果，鹤庆溢鑫截止2019年4月30日净资产评估价值为83,200.00万元，按照鹤庆工投对鹤庆溢鑫的实缴出资比例为13.71%计算，经与鹤庆工投协商一致，确定最终交易对价为11,400.00万元，评估基准日至股权交割日的期间损",云南铝业股份有限公司,云南文山铝业有限公司,鹤庆溢鑫铝业有限公司
1206506640,"北京数知科技股份有限公司关于收购上海品数科技有限公司100%股权的公告。北京数知科技股份有限公司（以下简称“公司”或“数知科技”）于2019年8月7日召开的第四届董事会第九次会议审议通过了《关于收购上海品数科技有限公司100%股权的议案》，同意公司使用自有资金12,000万元收购上海品数科技有限公司（以下简称“品数科技”或“标的公司”）100%股权（以下简称“本次交易”），具体情况如下：一、交易概述公司于2019年8月7日与品数科技股东宁波梅山保税港区品陌投资管理合伙企业（有限合伙）、宁波梅山保税港区室前投资管理合伙企业（有限合伙）、李梦杰、孙国成（以下简称“交易对方”）签订了《股权收购协议》（以下简称“收购协议”），公司以支付现金的方式收购交易对方持有的品数科技100%股权，本次交易作价为12,000万元。本次交易完成后，品数科技将成为公司的全资子公司。公司第四届董事会第九次会议以5票同意、0票反对、0票弃权通过了上述议案。根据《深圳证券交易所创业板股票上市规则》、《公司章程》及《对外投资管理办法》等有关规定，本次交易事项在公司董事会决策范围内，无须提交公司股东大会审议。本次交易不构",北京数知科技股份有限公司,宁波梅山保税港区品陌投资管理合伙企业、宁波梅山保税港区室前投资管理合伙企业,上海品数科技有限公司
1206506640,"北京数知科技股份有限公司关于收购上海品数科技有限公司100%股权的公告。北京数知科技股份有限公司（以下简称“公司”或“数知科技”）于2019年8月7日召开的第四届董事会第九次会议审议通过了《关于收购上海品数科技有限公司100%股权的议案》，同意公司使用自有资金12,000万元收购上海品数科技有限公司（以下简称“品数科技”或“标的公司”）100%股权（以下简称“本次交易”），具体情况如下：一、交易概述公司于2019年8月7日与品数科技股东宁波梅山保税港区品陌投资管理合伙企业（有限合伙）、宁波梅山保税港区室前投资管理合伙企业（有限合伙）、李梦杰、孙国成（以下简称“交易对方”）签订了《股权收购协议》（以下简称“收购协议”），公司以支付现金的方式收购交易对方持有的品数科技100%股权，本次交易作价为12,000万元。本次交易完成后，品数科技将成为公司的全资子公司。公司第四届董事会第九次会议以5票同意、0票反对、0票弃权通过了上述议案。根据《深圳证券交易所创业板股票上市规则》、《公司章程》及《对外投资管理办法》等有关规定，本次交易事项在公司董事会决策范围内，无须提交公司股东大会审议。本次交易不构",北京数知科技股份有限公司,李梦杰、孙国成,上海品数科技有限公司
1206507957,"东睦新材料集团股份有限公司NBTMNEWMATERIALSGROUPCo.,Ltd.关于收购股权的进展公告。重要内容提示：华晶粉末公司已办理完成股权转让的工商变更登记手续，但名称变更等相关事宜尚未办理完毕一、交易概述2019年8月5日，东睦新材料集团股份有限公司（以下简称“公司”）召开的第六届董事会第三十二次会议审议通过了《关于收购股权的议案》，董事会同意以现金人民币10,980万元收购宁波保税区晶鼎泰合企业管理合伙企业（有限合伙）、宁波保税区华景企业管理合伙企业（有限合伙）、宁波梅山保税港区华崇投资合伙企业（有限合伙）和宁波梅山保税港区华莞投资合伙企业（有限合伙）合计持有的东莞华晶粉末冶金有限公司（以下简称“华晶粉末公司”）61.00%股权。有关此次收购股权的具体内容，详见公司于2019年8月6日在上海证券交易所网站（临）2019-059。",东睦新材料集团股份有限公司,宁波保税区晶鼎泰合企业管理合伙企业、宁波保税区华景企业管理合伙企业、宁波梅山保税港区华崇投资合伙企业、宁波梅山保税港区华莞投资合伙企业,东莞华晶粉末冶金有限公司
1206508089,烟台龙源电力技术股份有限公司关于收购控股子公司烟台龙源换热设备有限公司股权的公告。35%一、交易概述烟台龙源电力技术股份有限公司（以下简称“龙源技术”或“公司”）为推动控股子公司烟台龙源换热设备有限公司（以下简称“龙源换热”）实现盈利及更好发展，拟以自有资金出资收购荏原冷热系统（中国）有限公司（以下简称“荏原公司”）所持有的龙源换热35%股权，实现对龙源换热的全资控股。本次收购龙源换热35%股权的交易事项公司已委托相关机构出具了资产评估报告、审计报告。根据评估结果，龙源换热截至2018年12月31日净资产账面价值为693.68万元，评估值为734.94万元，按照荏原公司对龙源换热的实缴出资比例35%计算，经与荏原公司协商一致，确定最终交易对价为257.00万元。龙源技术与荏原公司于2019年8月8日签署了《股权转让协议》，本次股权转让完成后公司将持有龙源换热100%的股权。根据《深圳证券交易所创业板股票上市规则》、《公司章程》及《公1司总经理工作细则》等的相关规定，本次收购股权事宜不构成关联交易，不构成《上市公司重大资产重组管理办法》规定的重大资产重组。本次收购股权事宜在公司管理层审批,烟台龙源电力技术股份有限公司,荏原冷热系统（中国）有限公司,烟台龙源换热设备有限公司
