id,content,买方,卖方,标的
1204299920,"上海皓元医药股份有限公司关于全资子公司皓元科技发展有限公司现金收购MEDCHEMEXPRESSLLC股权的公告。一、交易情况（一）基本情况1.收购方：皓元科技发展有限公司（以下简称“香港皓元”）,系上海皓元医药股份有限公司（以下简称“皓元医药”）100%控股全资子公司。2.转让方：MEDCHEMEXPRESSLLC（以下简称“MCE”），股东：GAOZhinong、GAOAnnie，GAOZhinong与GAOAnnie系父女关系。3.转让标的：MEDCHEMEXPRESSLLC100%的股权。4.交易事项：香港皓元用现金购买MCE股东GAOZhinong所持有的95%的股权、GAOAnnie所持有的5%的股权。5.购买资产价格：600,000美元。6.是否构成关联交易：本次收购事项不存在关联关系，故不构成关联交易。7.根据《非上市公众重大资产重组管理办法》第二条规定：“公众公司及控股或者控制的公司购买、出售资产，达到下列标准之一的，1/5构成重大资产重组：（一）购买、出售的资产总额占公众公司最近一个会计年度经审计的合并财务会计报表期末资产总额的比例达到50%以上；",皓元科技发展有限公司,MEDCHEMEXPRESSLLC,MEDCHEMEXPRESSLLC
1204397991,"河南索克物业发展股份有限公司关于收购股权的公告。一、交易概况(一)基本情况根据公司业务发展需要，河南索克物业发展股份有限公司（以下简称“公司”）拟以现金形式收购郑州鑫阳物业管理有限公司（以下简称“鑫阳物业”）股东李亚玲所持有的95%股权、股东王姝娟所持有的4%股权及股东胡梦洁所持有的1%股权。截至2018年1月31日，鑫阳物业净资产为4,790,994.70元,经双方协商一致，公司以现金5,000,000.00元的价格收购鑫阳物业100%的股权。根据《非上市公众公司重大资产重组管理办法》第二条规定：“公众公司及其控股或者控制的公司购买、出售资产，达到下列标准之一的，构成重大资产重组。（一）购买、出售的资产总额占公众公司最近一个会计年度经审计的合并财务会计报表期末资产总额的比例达到50%以上；",河南索克物业发展股份有限公司,李亚玲、王姝娟、胡梦洁,郑州鑫阳物业管理有限公司
1204487407,"招商证券股份有限公司关于高斯贝尔数码科技股份有限公司调整收购深圳市高斯贝尔家居智能电子有限公司100%股权方案暨关联交易的核查意见。招商证券股份有限公司（以下简称“招商证券”、“保荐机构”）作为高斯贝尔数码科技股份有限公司（以下简称“高斯贝尔”或“公司”）首次公开发行股票并上市的保荐机构，根据《证券发行上市保荐业务管理办法》、《深圳证券交易所中小企业板上市公司规范运作指引》等有关规定的要求，对公司调整收购深圳市高斯贝尔家居智能电子有限公司（以下简称“家居智能”）100%股权方案暨关联交易的事项进行了审慎核查，并出具核查意见如下：一、收购事项及方案调整概述（一）收购事项及进展2017年8月30日，高斯贝尔召开第三届董事会第九次会议，审议通过了《关于变更部分募集资金用途用于收购相关资产暨关联交易的议案》，同意公司本次以现金方式向深圳高视伟业创业投资有限公司（以下简称“高视创投”）、刘潭爱以及其他7名自然人购买家居智能100%股权，交易对价为2.5亿元，变更“高斯贝尔生产基地技术改造及产业化项目剩余募集资金9,408.11万元及其利息用以支付交易对价，不足部分由公司以自有资金支付。2017年",高斯贝尔数码科技股份有限公司,深圳高视伟业创业投资有限公司,深圳市高斯贝尔家居智能电子有限公司
1204487407,"招商证券股份有限公司关于高斯贝尔数码科技股份有限公司调整收购深圳市高斯贝尔家居智能电子有限公司100%股权方案暨关联交易的核查意见。招商证券股份有限公司（以下简称“招商证券”、“保荐机构”）作为高斯贝尔数码科技股份有限公司（以下简称“高斯贝尔”或“公司”）首次公开发行股票并上市的保荐机构，根据《证券发行上市保荐业务管理办法》、《深圳证券交易所中小企业板上市公司规范运作指引》等有关规定的要求，对公司调整收购深圳市高斯贝尔家居智能电子有限公司（以下简称“家居智能”）100%股权方案暨关联交易的事项进行了审慎核查，并出具核查意见如下：一、收购事项及方案调整概述（一）收购事项及进展2017年8月30日，高斯贝尔召开第三届董事会第九次会议，审议通过了《关于变更部分募集资金用途用于收购相关资产暨关联交易的议案》，同意公司本次以现金方式向深圳高视伟业创业投资有限公司（以下简称“高视创投”）、刘潭爱以及其他7名自然人购买家居智能100%股权，交易对价为2.5亿元，变更“高斯贝尔生产基地技术改造及产业化项目剩余募集资金9,408.11万元及其利息用以支付交易对价，不足部分由公司以自有资金支付。2017年",高斯贝尔数码科技股份有限公司,刘潭爱,深圳市高斯贝尔家居智能电子有限公司
1204487407,"招商证券股份有限公司关于高斯贝尔数码科技股份有限公司调整收购深圳市高斯贝尔家居智能电子有限公司100%股权方案暨关联交易的核查意见。招商证券股份有限公司（以下简称“招商证券”、“保荐机构”）作为高斯贝尔数码科技股份有限公司（以下简称“高斯贝尔”或“公司”）首次公开发行股票并上市的保荐机构，根据《证券发行上市保荐业务管理办法》、《深圳证券交易所中小企业板上市公司规范运作指引》等有关规定的要求，对公司调整收购深圳市高斯贝尔家居智能电子有限公司（以下简称“家居智能”）100%股权方案暨关联交易的事项进行了审慎核查，并出具核查意见如下：一、收购事项及方案调整概述（一）收购事项及进展2017年8月30日，高斯贝尔召开第三届董事会第九次会议，审议通过了《关于变更部分募集资金用途用于收购相关资产暨关联交易的议案》，同意公司本次以现金方式向深圳高视伟业创业投资有限公司（以下简称“高视创投”）、刘潭爱以及其他7名自然人购买家居智能100%股权，交易对价为2.5亿元，变更“高斯贝尔生产基地技术改造及产业化项目剩余募集资金9,408.11万元及其利息用以支付交易对价，不足部分由公司以自有资金支付。2017年",高斯贝尔数码科技股份有限公司,刘潭爱,深圳市高斯贝尔家居智能电子有限公司
1204707316,"青岛高校信息产业股份有限公司关于出售控股子公司股权交易方案调整的提示性公告。本一、基本情况青岛高校信息产业股份有限公司（以下简称“公司”）于2017年3月16日将公司持有的控股子公司青岛高新金财信息科技有限公司（以下简称“高新金财”）51%的股权以9,741万元的价格出售给方欣科技有限公司（以下简称“方欣科技”），具体内容详见公司披露于全国中小企业股份转让系统指定信息披露平台上的《关于出售控股子公司青岛高新金财信息由于宏观市场环境和财税行业政策在2017年发生了较大变化，致使交易各方原约定的盈利预测及业绩承诺未能达成。经交易各方充分沟通，本着谨慎、务实、可行的原则，并结合当前的市场环境，同意对高新金财的业绩承诺及公司估值进行调整，并由交易各方签署了《关于青岛高新金财信息科技有限公司收购方案调整的备忘录》，交易各方同意结合目前市场情况以及政策情况，基于高新金财管理团队重新测算的高新金财2018年至2020年的盈利预测数据，聘请具有证券从业资格的",方欣科技有限公司,青岛高校信息产业股份有限公司,青岛高新金财信息科技有限公司
1204711659,"河南古城传媒股份有限公司出售子公司股权的公告。一、交易概况（一）基本情况出售方：河南古城传媒股份有限公司交易对方：尚瑞澎、朱灏交易标的：公司持有的河南丰乾融泰实业有限公司60.00%的股权。交易事项：公司出售持有的河南丰乾融泰实业有限公司全部股权。交易价格：0.00元。公司持有河南丰乾融泰实业有限公司60.00%股权，因未实际出资，2017年度审计时未将河南丰乾融泰实业有限公司纳入合并范围，因此本次股权转让的交易价格为0元。本次交易不构成重大资产重组。公司经审计的2017年度合并财务报表期末总资产和净资产分别为40,742,602.55元和26,449,850.94元；如将河南丰乾融泰实业有限公司纳入合并范围，2017年末公司总资产和净资产分别为81,308,427.45元（未经审计）和29,127,373.70元（未经审计）；河南丰乾融泰实业有限公司20172,677,522.76元（未经审计）。根据《非上市公众公司重大资产重组管理办法》的相关规定：“公众公司及其控股或者控制的公司购买、出售资产，达到下列标准之一的，构成重大资产重组：(一)购买、出售的资产总额占公众公司最近一个会计年",尚瑞澎、朱灏,河南古城传媒股份有限公司,河南丰乾融泰实业有限公司
1204712213,"石家庄博宇科技股份有限公司关于出售子公司股权暨关联交易公告。一、交易概况（一）基本情况本次关联交易是偶发性关联交易石家庄博宇科技股份有限公司（以下简称“公司”）拟将持有的全资子公司石家庄超图科技开发有限公司（以下简称超图科技）100%股权出售给自然人李娟，转让价款为1,000万元。李娟为公司控股股东、实际控制人。上述交易构成了公司的关联交易。根据《非上市公众公司重大资产重组管理办法》的相关规定，出售股权未导致公众公司丧失被投资企业控股权的，其资产总额、资产净额均以该股权的账面价值为准。根据立信会计师事务所2018年4月20日出具的信会师报字[2018]第ZB10901号《审计报告》（以下简称“《审计报告》”），截至2017年12月31日，公司经审计的资产总额为108,935,530.14元（合并），资产净额为89,954,594.42元（合并）。截至2017年12月31日，超图科技子对应的账面价值为8,726,070.61元，占公司2017年会计年度经审计的合并财务会计报表期末资产总额、资产净额的比例分别8.01%、9.70%，因此，本次交易不构成重大资产重组。",李娟,石家庄博宇科技股份有限公司,石家庄超图科技开发有限公司
1204718988,"诚德科技股份有限公司关于收购浙江翔鹏新材料有限公司100%股权暨关联交易的公告。本一、交易概述（一）基本情况收购方：诚德科技股份有限公司（以下简称“公司”或“诚德股份”）交易对方：王道德、王道信交易标的：王道德及王道信持有的浙江翔鹏新材料有限公司（以下简称“翔鹏新材”）100%股权交易价格：人民币1,123.47万元协议签署日期：2018年4月15日此项交易构成关联交易，不构成重大资产重组。",诚德科技股份有限公司,王道德、王道信,浙江翔鹏新材料有限公司
1204735154,"辽宁科隆精细化工股份有限公司关于公司收购四川恒泽建材有限公司股权2017年度业绩承诺未实现情况的说明的公告。一、重大资产重组的基本情况收购四川恒泽建材有限公司100%股权基本情况2016年5月，辽宁科隆精细化工股份有限公司（简称“科隆股份”）2016年第一次临时股东大会审议通过发行股份及支付现金购买资产并募集配套资金暨关联交易的相关议案，科隆股份拟通过发行股份并支付现金的方式购买喀什新兴鸿溢创业投资有限公司、喀什泽源创业投资有限公司两名交易对方合计持有的四川恒泽建材有限公司（简称“四川恒泽”）100%股份，并募集配套资金。依据双方的《发行股份及支付现金购买资产之协议书》，本次交易标的资产作价为23,000.00万元。其中，发行股份支付对价金额为14,950.00万元，占全部收购价款的65%；现金对价金额为8,050.00万元，占全部收购价款的35%。同时，本次交易拟向蒲泽一、蒲静依、上海银叶阶跃资产管理有限公司管理的银叶阶跃定增1号私募基金发行股份募集配套资金，配套资金总额19,000.00万元。2016年8月5日，经中国证监会上市公司并购重组委员会召开的2016年第58次工作会议审核",辽宁科隆精细化工股份有限公司,喀什新兴鸿溢创业投资有限公司、喀什泽源创业投资有限公司,四川恒泽建材有限公司
1204735795,"中信银行股份有限公司关于收购阿尔金银行股份有限公司股权完成交割的公告。中信银行股份有限公司（以下简称“本行”）于2017年6月7日召开的董事会会议审议通过了《关于收购阿尔金银行股份有限公司股权相关事宜的议案》，于2018年1月25日召开的董事会会议审议通过了《关于修订并签署收购阿尔金银行股权相关交易文件以及调整相关交割安排的议案》。相关内容详见本行分别于2017年6月8日、2018年1月26日于上海证券交易所网站和本行网站披露的董事会会议决议公告。本行董事会现宣布，本行与中国双维投资有限公司合作购入哈萨克斯坦人民银行所持有的阿尔金银行60%股权交易（以下简称“本次收购”）的所有先决条件已根据本次收购协议条款达成或豁免，本次收购已取得中国和哈萨克斯坦相关监管机构的批准或认可；本次收购于2018年4月24日（北京时间）完成交割，本行与中国双维投资有限公司分别以22,176,344,910.7坚戈1、4,381,776,029.3坚戈的对价收购哈萨克斯坦人民银行所持有的阿尔金银行50.1%、9.9%的股权。特此公告。中信银行股份有限公司董事会2018年4月25日1根据哈萨克斯坦央行2018年",中信银行股份有限公司、中国双维投资有限公司,哈萨克斯坦人民银行,阿尔金银行
1204737982,"东方时尚驾驶学校股份有限公司关于收购高安市瑞鑫投资有限公司部分股权进展的公告。一、基本情况概述2017年12月28日，东方时尚驾驶学校股份有限公司（以下简称“公司”或“东方时尚”）第三届董事会第六次会议审议通过《关于收购高安市瑞鑫投资有限公司部分股权的议案》，同意收购高安市瑞鑫投资有限公司(以下简称“瑞鑫投资”)60%股权，交易金额为人民币9,000万元。具体内容详见公司于2017年12月30日在《上海证券报》、《证券时报》及上海证券交易所网站披露的临2017-080、临2017-084号公告。",东方时尚驾驶学校股份有限公司,高安市瑞鑫投资有限公司,高安市瑞鑫投资有限公司
1204738756,"惠州硕贝德无线科技股份有限公司关于收购控股子公司部分少数股东股权的公告。一、本次交易概述为推进公司发展战略，增强可持续发展能力及盈利能力，惠州硕贝德无线科技股份有限公司（以下简称“公司”、“硕贝德”）拟收购公司控股子公司江苏凯尔生物识别科技有限公司（以下简称“江苏凯尔”、“标的公司”）少数股东持有江苏凯尔24.044%的股权，转让对价共计5,818.648万元人民币。其中，公司拟受让金运实业有限公司(以下简称“金运实业”)持有的江苏凯尔9.477%的股权，支付对价为2,293.434万元人民币；受让苏州凯尔德咨询管理中心（有限合伙）(以下简称“凯尔德”)持有的江苏凯尔8.00%的股权，支付对价为1,936.00万元人民币；受让林伟平持有的江苏凯尔6.567%的股权，支付对价为1,589.214万元人民币。本次交易完成后，公司对江苏凯尔的持股比例由51.912%上升至75.956%。本次交易前，金运实业、凯尔德、林伟平分别持有江苏凯尔18.954%、16.00%、13.134%的股权，根据《深圳证券交易所创业板股票上市规则（2014年修订)》的规定，金运实业、凯尔德、林伟平不属于关联方，",惠州硕贝德无线科技股份有限公司,金运实业有限公司、苏州凯尔德咨询管理中心,江苏凯尔生物识别科技有限公司
1204738756,"惠州硕贝德无线科技股份有限公司关于收购控股子公司部分少数股东股权的公告。一、本次交易概述为推进公司发展战略，增强可持续发展能力及盈利能力，惠州硕贝德无线科技股份有限公司（以下简称“公司”、“硕贝德”）拟收购公司控股子公司江苏凯尔生物识别科技有限公司（以下简称“江苏凯尔”、“标的公司”）少数股东持有江苏凯尔24.044%的股权，转让对价共计5,818.648万元人民币。其中，公司拟受让金运实业有限公司(以下简称“金运实业”)持有的江苏凯尔9.477%的股权，支付对价为2,293.434万元人民币；受让苏州凯尔德咨询管理中心（有限合伙）(以下简称“凯尔德”)持有的江苏凯尔8.00%的股权，支付对价为1,936.00万元人民币；受让林伟平持有的江苏凯尔6.567%的股权，支付对价为1,589.214万元人民币。本次交易完成后，公司对江苏凯尔的持股比例由51.912%上升至75.956%。本次交易前，金运实业、凯尔德、林伟平分别持有江苏凯尔18.954%、16.00%、13.134%的股权，根据《深圳证券交易所创业板股票上市规则（2014年修订)》的规定，金运实业、凯尔德、林伟平不属于关联方，",惠州硕贝德无线科技股份有限公司,林伟平,江苏凯尔生物识别科技有限公司
1204739587,"北京金一文化发展股份有限公司关于收购股权业绩承诺实现情况的专项说明一、收购股权方案及审批核准、实施情况2015年4月7日，公司与北京金一江苏珠宝有限公司（以下简称“金一江苏”）股东江苏创禾华富商贸有限公司（以下简称“创禾华富”）签署《北京金一文化发展股份有限公司与江苏创禾华富商贸有限公司之间关于南京宝庆尚品珠宝连锁有限公司之购买资产协议》（以下简称“购买资产协议”），公司拟以自有资金人民币39,780.00万元向创禾华富收购其所持金一江苏的51%股权。2015年4月8日召开的第二届董事会第三十三次会议及2015年4月30日召开的2014年度股东大会审议通过了《关于收购南京宝庆尚品珠宝连锁有限公司51%股权的议案》，同意公司以39,780.00万元收购金一江苏51%的股权。2017年尚在业绩考核期内。南京宝庆尚品珠宝连锁有限公司于2017年2月21日更名为北京金一江苏珠宝有限公司。",北京金一文化发展股份有限公司,江苏创禾华富商贸有限公司,北京金一江苏珠宝有限公司
1204739588,"北京金一文化发展股份有限公司关于收购股权业绩承诺实现情况的专项说明一、收购股权方案及审批核准、实施情况2016年4月6日，公司与广东乐源数字技术有限公司（以下简称“广东乐源”）股东乐六平签署《北京金一文化发展股份有限公司与乐六平之间关于广东乐源数字技术有限公司之增资及股权转让协议》（以下简称“增资及股权转让协议”），公司拟以自有或自筹资金人民币18,700.00万元对广东乐源进行增资，其中733.0999万元计入广东乐源的注册资本，占广东乐源增资后注册资本的11%，17,966.9001万元计入广东乐源的资本公积；同时，公司拟以68,000.00万元向乐六平收购其所持广东乐源的40%股权。本次交易完成后，公司共计持有广东乐源51%的股权并取得其控制权。公司于2016年4月13日召开的第二届董事会第六十二次会议及2016年5月9日召开的2015年度股东大会审议通过了《关于收购广东乐源数字技术有限公司51%股权的议案》，同意公司收购广东乐源51%的股权。广东乐源已完成了股权变更的工商变更登记手续，并领取了当地工商行政管理局换发的《企业法人营业执照》，统一社会信用代码为91440101574",北京金一文化发展股份有限公司,乐六平,广东乐源数字技术有限公司
1204787427,山西漳泽电力股份有限公司关于终止收购香港融资租赁公司部分股权及转让上海融资租赁公司部分股权关联交易事项的公告。一、关于筹划收购大同煤矿集团（香港）融资租赁公司部分股权及转让同煤漳泽（上海）融资租赁有限责任公司部分股权事项的基本情况山西漳泽电力股份有限公司（以下简称“漳泽电力”或“公司”）于2017年3月10日召开八届十次董事会通过了《关于收购大同煤矿集团（香港）融资租赁有限公司80%股权的关联交易预案》、《关于转让同煤漳泽（上海）融资租赁公司部分股权的关联交易预案》，其中：公司拟收购大同煤矿集团有限责任公司（以下简称“同煤集团”）持有的大同煤矿集团（香港）融资租赁有限公司（以下简称“香港融资租赁”）80%股权；通过协议转让的方式向大同煤业股份有限公司（以下简称“大同煤业”）转让同煤漳泽（上海）融资租赁有限责任公司（以下简称“上海融资租赁公司”）20%股权；通过进场公开挂牌交易的方式转让上海融资租赁公司20%股权。上述议案经于2017年3月28日召开的2017年第三次临时股东大会审议并通过。鉴于在市场上尚未找到意向受让方，公司拟将持有的上海融资租赁公司的20%股权继续转让给大同煤业。公司,山西漳泽电力股份有限公司,大同煤矿集团有限责任公司,大同煤矿集团（香港）融资租赁有限公司
1204787427,山西漳泽电力股份有限公司关于终止收购香港融资租赁公司部分股权及转让上海融资租赁公司部分股权关联交易事项的公告。一、关于筹划收购大同煤矿集团（香港）融资租赁公司部分股权及转让同煤漳泽（上海）融资租赁有限责任公司部分股权事项的基本情况山西漳泽电力股份有限公司（以下简称“漳泽电力”或“公司”）于2017年3月10日召开八届十次董事会通过了《关于收购大同煤矿集团（香港）融资租赁有限公司80%股权的关联交易预案》、《关于转让同煤漳泽（上海）融资租赁公司部分股权的关联交易预案》，其中：公司拟收购大同煤矿集团有限责任公司（以下简称“同煤集团”）持有的大同煤矿集团（香港）融资租赁有限公司（以下简称“香港融资租赁”）80%股权；通过协议转让的方式向大同煤业股份有限公司（以下简称“大同煤业”）转让同煤漳泽（上海）融资租赁有限责任公司（以下简称“上海融资租赁公司”）20%股权；通过进场公开挂牌交易的方式转让上海融资租赁公司20%股权。上述议案经于2017年3月28日召开的2017年第三次临时股东大会审议并通过。鉴于在市场上尚未找到意向受让方，公司拟将持有的上海融资租赁公司的20%股权继续转让给大同煤业。公司,大同煤业股份有限公司,山西漳泽电力股份有限公司,同煤漳泽（上海）融资租赁有限责任公司
1204787889,"关于收购南京正华通捷电子系统工程有限公司股权完成工商变更的公告。厦门市建筑科学研究院集团股份有限公司关于收购南京正华通捷电子系统工程有限公司股权完成工商变更的公告一、基本情况厦门市建筑科学研究院集团股份有限公司（以下简称“公司”）于2018年3月12日召开了第四届董事会第十六次会议，审议通过了《关于公司使用自有资金收购南京正华通捷电子系统工程有限公司股权的议案》，并于2018年3月12日与陈界鹏、南京通捷投资中心（有限合伙）签订了《购买资产协议》及《购买之资产盈利及减值补偿协议》，以自有资金18,000万元人民币收购其持有的南京正华通捷电子系统工程有限公司（以下简称“南京正华”）100%股权。具体内容详见公司于2018年3月13日在《证券日报》、《证券时报》及巨潮资讯网上披露2018-015）。根据《购买资产协议》的约定，公司已于近日完成了南京正华股权过户手续及工商变更登记。本次股权变更完成后，公司持有南京正华100%股权。",厦门市建筑科学研究院集团股份有限公司,陈界鹏,南京正华通捷电子系统工程有限公司
