id,content,买方,卖方,标的
1205430756,"天津鑫茂科技股份有限公司关于现金收购富通光纤光缆（成都）有限公司80%股权暨关联交易的公告。重要内容提示：为增强上市公司盈利能力，天津鑫茂科技股份有限公司（以下简称“鑫茂科技”、“公司”或“上市公司”）拟以现金方式购买公司实际控制人控制的企业杭州富通通信技术股份有限公司（以下简称“富通通信”）持有的富通光纤光缆（成都）有限公司（以下简称“富通成都”或“标的公司”）80%股权，交易对价为人民币66,363万元。本次交易完成后，公司将持有富通成都80%股权，成为其控股股东。富通通信承诺：2018年度、2019年度和2020年度，富通成都实现的扣除非经常性损益后归属于母公司股东的净利润分别不低于7,939万元、9,877万元和11,824万元。本次交易构成关联交易，不构成重大资产重组，不构成重组上市。本次交易已经公司第七届董事会第四十五次会议、第七届监事会第二十次会议审议通过，尚需提交公司股东大会审议。根据标的公司行业特点和经营环境，本次交易存在一定风险，具体详见本公告“十、风险提示”部分。一、关联交易概述（一）关联交易内容为增强上市公司盈利能力，公司拟以现金方式购买富通通信持有的富通成都1",天津鑫茂科技股份有限公司,杭州富通通信技术股份有限公司,富通光纤光缆（成都）有限公司
1205432264,"广东众生药业股份有限公司关于收购广东逸舒制药股份有限公司小股东部分股权的进展公告。广东众生药业股份有限公司（以下简称“公司”）于2018年8月31日召开第六届董事会第十八次会议，全体董事一致审议通过《关于收购广东逸舒制药股份有限公司小股东部分股权的议案》，同意公司使用自有资金人民币76,648,672.10元向黄苏苹、欧俊华、刘凌梅、黄庆文收购其合计所持有的广东逸舒制药股份有限公司（以下简称“逸舒制药”）12.2221%股权。同日，公司与交易对方黄苏苹、欧俊华、刘凌梅、黄庆文及相关方黄庆雄签署了《股份转让协议》。本次收购完成后，公司对控股子公司逸舒制药的持股比例增加。具体内容详见公司于2018年9月1日在信息披露媒体《证券时报》和巨潮资讯网披露的相关公告。截至目前，公司根据《股份转让协议》约定，并按照新三板交易规则实施完成上述逸舒制药小股东12.2221%股份的收购，目前持有逸舒制药83.7697%股份，逸舒制药为公司的控股子公司。特此公告。广东众生药业股份有限公司董事会二〇一八年九月十二日第1页共1页",广东众生药业股份有限公司,黄苏苹、欧俊华、刘凌梅、黄庆文,广东逸舒制药股份有限公司
1205432841,"宁夏银星能源股份有限公司关于现金收购风电股权暨关联交易的公告。本公司及董事会全体成员保证信息披露内容的真实、一、本次交易的情况概述1.为了继续兑现控股股东中铝宁夏能源集团有限公司（以下简称中铝宁能）解决同业竞争的承诺，加快宁夏银星能源股份有限公司（以下简称公司）在风力发电领域的发展，公司拟以31,249.22万元收购中铝宁能持有的宁夏银仪风力发电有限责任公司（以下简称银仪风电）50%股权、中铝宁能持有的陕西丰晟能源有限公司（以下简称陕西丰晟）100%股权、中铝宁能持有的陕西西夏能源有限公司（以下简称陕西西夏）51%股权，其中：公司以15,475.39万元收购中铝宁能持有银仪风电50%股权,以8,819.09万元收购中铝宁能持有陕西丰晟100%股权、以6,954.74万元收购中铝宁能持有陕西西夏51%股权。本次收购完成后，公司将按照会计政策对陕西丰晟和陕西西夏合并报表。2.公司于2018年9月12日召开的第七届董事会第十三次临时会议，经关联董事高原先生、吴解萍女士、王彦军先生、马建勋先生、张锐先生、雍锦宁先生回避表决后，以3票同意、0票1反对、0票弃权的表决结果，公司董事会审议通过了《关",宁夏银星能源股份有限公司,中铝宁夏能源集团有限公司,宁夏银仪风力发电有限责任公司、陕西丰晟能源有限公司、陕西西夏能源有限公司
1205434464,"天润曲轴股份有限公司关于收购控股子公司少数股东股权的公告。本一、交易概述文登恒润锻造有限公司（以下简称“恒润锻造”）为天润曲轴股份有限公司（以下简称“公司”、“天润曲轴”）的控股子公司，注册资本210万美元，主营汽车零部件毛坯的加工与销售。公司持有其75%的股权，远通投资有限公司持有其25%的股权。2018年9月12日，公司召开第四届董事会第十九次会议，会议审议通过了《关于收购控股子公司少数股东股权的议案》，根据公司经营发展需要，董事会同意公司使用自有资金人民币3,000万元收购远通投资有限公司持有的恒润锻造25%的股权。本次交易完成后，恒润锻造将成为公司全资子公司。2018年9月12日，公司与远通投资有限公司签署了《关于文登恒润锻造有限公司的股权转让协议》。本次交易不构成关联交易，不构成《上市公司重大资产重组管理办法》规定的重大资产重组。根据《深圳证券交易所股票上市规则》和《公司章程》等相关规定，本次交易在董事会的审批权限之内，无需提交公司股东大会审议。",天润曲轴股份有限公司,远通投资有限公司,文登恒润锻造有限公司
1205434485,"深圳美丽生态股份有限公司关于收购福建省隧道工程有限公司股权事项的进展公告。深圳美丽生态股份有限公司（以下简称“公司”）于2017年12月15日召开了第九届董事会第三十二次会议、于2018年2月13日召开了2018年第一次临时股东大会，审议通过了《关于收购福建省隧道工程有限公司51%股权的议案》潭鑫晟股权投资合伙企业（有限合伙）及自然人林君济所持有的福建省隧道工程有限公司（以下简称“隧道公司”）51%的股权，具体内容详见公司于2018年2月2日在披露的《修正后的关于收购福建省隧道工程有限公司51%股权的公告》。2018年2月23日，公司披露了《关于收购福建省隧道工程有限公司51%股记手续，并取得了变更后的营业执照。2018年9月7日，公司支付了35,085.8951万元股权收购款，具体内容详见公司于2018年9月8日披露的《关于收购福建省隧道工程有限公司股权事项2018年9月12日，公司支付了剩余的股权收购款53.1049万元。至此，公司收购隧道公司51%股权的收购款已支付完毕，隧道公司成为公司的控股子公司。特此公告。深圳美丽生态股份有限公司董事会2018年9月13日",深圳美丽生态股份有限公司,潭鑫晟股权投资合伙企业,福建省隧道工程有限公司
1205434485,"深圳美丽生态股份有限公司关于收购福建省隧道工程有限公司股权事项的进展公告。深圳美丽生态股份有限公司（以下简称“公司”）于2017年12月15日召开了第九届董事会第三十二次会议、于2018年2月13日召开了2018年第一次临时股东大会，审议通过了《关于收购福建省隧道工程有限公司51%股权的议案》潭鑫晟股权投资合伙企业（有限合伙）及自然人林君济所持有的福建省隧道工程有限公司（以下简称“隧道公司”）51%的股权，具体内容详见公司于2018年2月2日在披露的《修正后的关于收购福建省隧道工程有限公司51%股权的公告》。2018年2月23日，公司披露了《关于收购福建省隧道工程有限公司51%股记手续，并取得了变更后的营业执照。2018年9月7日，公司支付了35,085.8951万元股权收购款，具体内容详见公司于2018年9月8日披露的《关于收购福建省隧道工程有限公司股权事项2018年9月12日，公司支付了剩余的股权收购款53.1049万元。至此，公司收购隧道公司51%股权的收购款已支付完毕，隧道公司成为公司的控股子公司。特此公告。深圳美丽生态股份有限公司董事会2018年9月13日",深圳美丽生态股份有限公司,林君济,福建省隧道工程有限公司
1205434527,"武汉海特生物制药股份有限公司关于收购天津市汉康医药生物技术有限公司100%的股权公告。一、交易概述为强化公司研发实力、丰富公司产品线，武汉海特生物制药股份有限公司（以下简称“公司”）拟购买天津市汉康医药生物技术有限公司（以下简称“天津汉康”）100%的股权。本次交易的价格是经上海东洲资产评估有限公司评估，出具的以2018年7月31日为评估基准日的东洲评报字第1032号《资产评估报告》为依据，双方协商后最终价格为人民币45,000万元。2018年9月13日，公司第六届董事会第十六次会议审议通过了《关于收购天津市汉康医药生物技术有限公司100%的股权的议案》，本议案尚需股东大会审议批准。本次交易不构成关联交易，也不构成《上市公司重大资产重组管理办法》规定的重大资产重组。",武汉海特生物制药股份有限公司,天津市汉康医药生物技术有限公司,天津市汉康医药生物技术有限公司
1205434830,天津鹏翎集团股份有限公司拟收购河北新欧汽车零部件科技有限公司股权项目资产评估说明中联评报字第1579号中中联联资资产产评评估估集集团团有有限限公公司司二二〇〇一一八八年年九九月月十十三三日日天津鹏翎集团股份有限公司拟收购河北新欧汽车零部件科技有限公司股权评估项目·资产评估说明目录第一部分关于评估说明使用范围的声明。1第二部分企业关于进行资产评估有关事项的说明。2第三部分资产清查核实情况说明。3一、评估对象与评估范围说明。3,天津鹏翎集团股份有限公司,河北新欧汽车零部件科技有限公司,河北新欧汽车零部件科技有限公司
1205434924,深圳市新国都技术股份有限公司关于子公司收购惠州市惠信资信评级有限公司100%股权的进展公告。2018年8月13日，深圳市新国都技术股份有限公司召开第四届董事会第二十三次会议，审议通过《关于子公司收购惠州市惠信资信评级有限公司100%股权的议案》，同意子公司深圳市新国都金服技术有限公司（以下简称“新国都金服”）以现金人民币160.01万元人民币收购惠州市惠信资信评级有限公司（以下简称“惠州惠信”）的100%股权。2018年8月13日，新国都金服与惠州惠信签署《深圳市新国都金服技术有限公司与惠州市惠信资信评级有限公司全体股东签署之于惠州市惠信资信评级有限公司之股权转让协议》。2018年8月29日，新国都金服收到惠州惠信完成工商变更登记及备案手续的通知，惠州惠信已取得惠州市惠城区市场监督管理局颁发的变更后的《营业执照》，新国都金服成为惠州惠信唯一出资人。相关工商信息如下：变更项目变更前股东信息变更后股东信息股东陈晓丹深圳市新国都金服技术有限蔡志强公司法定代表人陈晓丹李胜富出资额400万人民币400万人民币出资比例100%100%（1）公司名称：惠州市惠信资信评级有限公司（2）统一社会信用代码,深圳市新国都金服技术有限公司,深圳市新国都金服技术有限公司,惠州市惠信资信评级有限公司
1205436928,湖北宜昌交运集团股份有限公司关于收购控股子公司少数股权的公告。本一、交易概述1.宜昌太平溪港旅游客运有限公司（以下简称“太平溪港”）为湖北宜昌交运集团股份有限公司（以下简称“公司”或“本公司”）控股子公司，由公司与宜昌东湖国有资产经营有限公司（以下简称“东湖国资公司”）共同投资设立，注册资本2300万元。其中：本公司出资1800万元，持股占比78.26%；东湖国资公司出资500万元，持股占比21.74%。其经营范围为：港口经营，客运站经营。根据《市人民政府办公室关于印发2018年“两坝一峡”旅游区提质转型工作计划的通知》文件精神，为了进一步提升太平溪港运行管理效率，充分发挥公司旅游港口协调联动作用，公司拟以自有资金收购东湖国资公司持有太平溪港的全部股权，太平溪港在本次交易完成后将成为公司的全资子公司。2.本次交易已经2018年9月14日召开的公司第四届董事会第十五次会议审议通过，根据《公司章程》规定，本次投资事项无需提交股东大会审议。3.本次对外投资不构成关联交易，不属于《上市公司重大资产重组管理,湖北宜昌交运集团股份有限公司,宜昌东湖国有资产经营有限公司,宜昌太平溪港旅游客运有限公司
1205442701,"上海康耐特旗计智能科技集团股份有限公司关于收购保险经纪公司70%股权的公告。本一、交易概述1、交易基本情况为完善上海康耐特旗计智能科技集团股份有限公司（以下简称“公司”）业务和战略布局，公司拟使用自有资金人民币4,900万元收购上海合晖保险经纪有限公司（以下简称“合晖”）70%的股权，收购完成后，合晖将成为公司的控股子公司。2、交易审议情况2018年9月16日，公司第四届董事会第二十三次会议审议通过了《关于收购保险经纪公司70%股权的议案》，同意公司收购合晖70%的股权。同日，公司与交易对方签署了《关于上海合晖保险经纪有限公司之股权转让协议》。本交易事项在公司董事会决策权限内，无需提交股东大会审议批准。本交易事项不构成关联交易，也不构成《上市公司重大资产重组管理办法》规定的重大资产重组。",上海康耐特旗计智能科技集团股份有限公司,上海合晖保险经纪有限公司,上海合晖保险经纪有限公司
1205443037,"浙江永太科技股份有限公司关于收购滨海美康药业有限公司100%股权暨对外投资的公告。一、对外投资概述1、投资基本情况2018年9月14日，浙江永太科技股份有限公司（以下简称“公司”或“永太科技”）拟与浙江永诚盈富资产管理有限公司（以下简称“永诚盈富”）签署了《资产购买协议》，以自有资金人民币6,181.60万元收购永诚盈富所持滨海美康药业有限公司（以下简称“滨海美康”或“标的公司”）100%股权。2、董事会审议情况2018年9月14日，公司第四届董事会第二十四次会议审议通过了《关于收购滨海美康药业有限公司100%股权暨对外投资的议案》，依据《深圳证券交易所股票上市规则》和《公司章程》的相关规定，本次投资事项属于公司董事会审议决策事项，无需提交公司股东大会审议。3、本次投资不构成关联交易，也不构成《上市公司重大资产重组管理办法》规定的重大资产重组。",浙江永太科技股份有限公司,浙江永诚盈富资产管理有限公司,滨海美康药业有限公司
1205443314,"宁夏银星能源股份有限公司关于现金收购风电股权的补充公告。本公司及董事会全体成员保证信息披露的内容真实、准特别提示：公司于2018年9月13日在《证券时报》、《证券日报》、《中国证券报》、《上海证券报》和巨潮资讯网披露了《关于现金收购风电股权分地了解本次投资事项，公司特做补充说明，以下加粗倾斜字体为补充和调整内容，敬请广大投资者留意。一、交易概述1.为了继续兑现控股股东中铝宁夏能源集团有限公司（以下简称中铝宁能）解决同业竞争的承诺，加快宁夏银星能源股份有限公司（以下简称公司）在风力发电领域的发展，公司拟以31,249.22万元收购中铝宁能持有的宁夏银仪风力发电有限责任公司（以下简称银仪风电）50%股权、中铝宁能持有的陕西丰晟能源有限公司（以下简称陕西丰晟）100%股权、中铝宁能持有的陕西西夏能源有限公司（以下简称陕西西夏）51%股权，资金来源自筹，其中：公司以15,475.39万元收购中铝宁能持有银仪风电50%股权、以8,819.09万元收购中铝宁能持有陕西丰晟100%1股权、以6,954.74万元收购中铝宁能持有陕西西夏51%股权。鉴于中铝宁能系公司控股股东，持有公司股份40.23%，",宁夏银星能源股份有限公司,中铝宁夏能源集团有限公司,宁夏银仪风力发电有限责任公司、陕西丰晟能源有限公司、陕西西夏能源有限公司
1205443317,"河北汇金机电股份有限公司关于出售上海棠宝电子商务有限公司25%股权暨关联交易的进展公告。2018年9月11日河北汇金机电股份有限公司（以下简称“公司”）与公司控股股东石家庄鑫汇金投资有限公司（以下简称“鑫汇金”）签署了《关于转让上海棠宝电子商务有限公司股权协议书》（以下简称“协议书”），公司向控股股东鑫汇金转让其持有的上海棠宝电子商务有限公司（以下简称“棠宝电子”）25%股权，根据北京中和谊资产评估有限公司出具的编号为中和谊评报字11132号《资产评估报告》，并经双方协商，棠宝电子25%股权转让价款为1,324.545万元。本次交易完成后，公司将对历年权益法核算部分进行冲回，预计影响合并报表2018年度归属于母公司净利润金额增加约为366万元。上述事项已经公司第三届董事会第二十五次会议、第三届监事会第二十一次会议审议通过。详细内容请见公司2018年9月12日发布于巨潮资讯网的相关公告。2018年9月17日公司收到鑫汇金发来的《债务偿还确认通知》，认可公司已清偿完毕1,324.545万元债务。根据《协议书》相关条款，鑫汇金已完成本次股权交易全部股权转让价款支付义务。根据《协议书》相关条款",石家庄鑫汇金投资有限公司,河北汇金机电股份有限公司,上海棠宝电子商务有限公司
1205443766,山东天鹅棉业机械股份有限公司关于收购武汉中软通科技有限公司51.00%股权的公告。重要内容提示：山东天鹅棉业机械股份有限公司拟支付现金1.632亿元收购王小伟、北京华容信息技术中心（有限合伙）（以下简称“华容信息”）、北京天创云瑞投资中心（有限合伙）（以下简称“天创云瑞”）及北京天创创润投资中心（有限合伙）（以下简称“天创创润”）合计持有的武汉中软通科技有限公司51%的股权。本次交易不构成关联交易本次交易不构成重大资产重组交易实施不存在重大法律障碍本次交易已经公司第五届董事会第七次会议审议通过，尚需提交公司股东大会审议。一、交易概述（一）本次交易的基本情况为引进优质资产，公司拟以现金1.632亿元收购中软通51%的股权，本次交易中王小伟出让其持有的中软通40.80%股权，华容信息出让其持有的中软通5.10%股权，天创云瑞出让其持有的中软通3.06%股权，天创创润出让其持有的中软通2.04%股权，交易完成后，公司将持有中软通51.00%股权。本次交易以具有证券、期货从业资格的中水致远资产评估有限公司（以下简称“中水致远”）出具的标的《资产评估报告》为基础确定。根据中水致远出具的标的,山东天鹅棉业机械股份有限公司,北京华容信息技术中心、北京天创云瑞投资中心、北京天创创润投资中心,武汉中软通科技有限公司
1205443766,山东天鹅棉业机械股份有限公司关于收购武汉中软通科技有限公司51.00%股权的公告。重要内容提示：山东天鹅棉业机械股份有限公司拟支付现金1.632亿元收购王小伟、北京华容信息技术中心（有限合伙）（以下简称“华容信息”）、北京天创云瑞投资中心（有限合伙）（以下简称“天创云瑞”）及北京天创创润投资中心（有限合伙）（以下简称“天创创润”）合计持有的武汉中软通科技有限公司51%的股权。本次交易不构成关联交易本次交易不构成重大资产重组交易实施不存在重大法律障碍本次交易已经公司第五届董事会第七次会议审议通过，尚需提交公司股东大会审议。一、交易概述（一）本次交易的基本情况为引进优质资产，公司拟以现金1.632亿元收购中软通51%的股权，本次交易中王小伟出让其持有的中软通40.80%股权，华容信息出让其持有的中软通5.10%股权，天创云瑞出让其持有的中软通3.06%股权，天创创润出让其持有的中软通2.04%股权，交易完成后，公司将持有中软通51.00%股权。本次交易以具有证券、期货从业资格的中水致远资产评估有限公司（以下简称“中水致远”）出具的标的《资产评估报告》为基础确定。根据中水致远出具的标的,山东天鹅棉业机械股份有限公司,王小伟,武汉中软通科技有限公司
1205447107,"关于北京中海沃邦能源投资有限公司后续股权收购的承诺北京中海沃邦能源投资有限公司（以下简称“中海沃邦”、“标的公司”、“公司”），是一家依据中华人民共和国法律有效存续的有限责任公司，统一社会信用代码为91110102663748511Y，注册资本为555,555,556元。上海沃施园艺股份有限公司（以下简称“沃施股份”、“本公司”）已与中海沃邦的相关股东签署了《关于北京中海沃邦能源投资有限公司收购框架协议》（以下简称“《收购框架协议》”）及《关于北京中海沃邦能源投资有限公司收购框架协议之补充协议》（以下简称“《补充协议（一）》”），并签署了具体履行《收购框架协议》及《补充协议（一）》的《股权转让协议》及《发行股份购买资产协议》。前述协议实施完毕后，沃施股份将直接及间接控制中海沃邦50.50%股权，中海沃邦剩余49.5%股权由山西汇景企业管理咨询有公司（以下简称“山西汇景”）、山西瑞隆天成商贸有限公司（以下简称“山西瑞隆”）、博睿天晟（北京）投资有限公司（以下简称“博睿天晟”）持有。本公司尚未与山西汇景、山西瑞隆、博睿天晟达成关于标的公司后续股权的交易协议和交易意向，本公司将综合考虑本次交",上海沃施园艺股份有限公司,北京中海沃邦能源投资有限公司,北京中海沃邦能源投资有限公司
1205455495,"广东众生药业股份有限公司关于收购逸舒制药部分股权事项的进展公告。广东众生药业股份有限公司（以下简称“公司”、“众生药业”）于2017年10月24日召开第六届董事会第九次会议审议通过了《关于收购广东逸舒制药股份有限公司部分股权的议案》，同日，公司与交易对方黄庆文、黄庆雄、黄苏苹、欧俊华、刘凌梅5名自然人签署了《股份转让协议》。收购完成后，公司将持有广东逸舒制药股份有限公司（以下简称“逸舒制药”）80.5260%股权，逸舒制药成为公司的控股子公司。根据《股份转让协议》约定：黄庆文先生、黄庆雄先生应将其基于本协议项下交易所获得的对价款项中总计不低于10,000万元人民币的额度（含本数）用于在二级市场上购买众生药业流通股份，购买分两期实施完毕，首期用于购买众生药业股票支付的款项应不低于2,000万元人民币；黄庆文先生、黄庆雄先生应在第一批次股份交易完成后三个月内完成首期购买，并应在第三批次股份交易完成后的三个月内完成第二期购买。黄庆文、黄庆雄已于2017年12月完成首期不低于人民币2,000万元的众生药业股票买入。具体内容详见公司于2017年10月25日及2017年12月20日在信息披露媒体《",广东众生药业股份有限公司,黄庆文、黄庆雄、黄苏苹、欧俊华、刘凌梅,广东逸舒制药股份有限公司
